symbol,title,url,time_published,authors,summary,banner_image,source,category_within_source,source_domain,topics,overall_sentiment_score,overall_sentiment_label,ticker_sentiments
AAPL,"Market Clubhouse Morning Memo - November 15th, 2023  ( Trade Strategy For SPY, QQQ, AAPL, MSFT, NVDA, META, TSLA, And GOOGL )  - Invesco QQQ Trust, Series 1  ( NASDAQ:QQQ ) ",https://www.benzinga.com/trading-ideas/23/11/35808078/market-clubhouse-morning-memo-november-15th-2023-trade-strategy-for-spy-qqq-aapl-msft-nvda-meta-tsl,20231115T155337,['RIPS'],"Good Morning Traders! In today's Market Clubhouse Morning Memo, we will discuss SPY, QQQ, AAPL, MSFT, NVDA, META, TSLA, and GOOGL. Our proprietary formula, exclusive to Market Clubhouse, dictates these price levels. This dynamic equation takes into account price, volume, and options flow.",https://cdn.benzinga.com/files/market-clubhouse-morning-memo_109.png?width=1200&height=800&fit=crop,Benzinga,Markets,www.benzinga.com,"[{'topic': 'Economy - Monetary', 'relevance_score': '0.158519'}, {'topic': 'Financial Markets', 'relevance_score': '0.996023'}, {'topic': 'Manufacturing', 'relevance_score': '0.5'}, {'topic': 'Technology', 'relevance_score': '0.5'}]",0.220593,Somewhat-Bullish,[]
AAPL,Wholesale Inflation Lower Than Expected But Retail Sales Data Creates A Rethink In The Stock Market - Target  ( NYSE:TGT ) ,https://www.benzinga.com/markets/23/11/35807623/wholesale-inflation-lower-than-expected-but-retail-sales-data-creates-a-rethink-in-the-stock-market,20231115T153734,['The Arora Report'],"To gain an edge, this is what you need to know today. Please click here for a chart of SPDR S&P 500 ETF Trust SPY which represents the benchmark stock market index S&P 500 ( SPX ) . Headline PPI came at -0.5% vs. 0.1% consensus. This is the biggest decline since April 2020.",https://cdn.benzinga.com/files/yiorgos-ntrahas-mcauhlgirvs-unsplash_8_9.jpg?width=1200&height=800&fit=crop,Benzinga,Trading,www.benzinga.com,"[{'topic': 'Technology', 'relevance_score': '0.2'}, {'topic': 'Finance', 'relevance_score': '0.2'}, {'topic': 'Economy - Monetary', 'relevance_score': '0.158519'}, {'topic': 'Retail & Wholesale', 'relevance_score': '0.2'}, {'topic': 'Financial Markets', 'relevance_score': '0.999894'}, {'topic': 'Manufacturing', 'relevance_score': '0.2'}, {'topic': 'Earnings', 'relevance_score': '0.795202'}, {'topic': 'Real Estate & Construction', 'relevance_score': '0.2'}]",0.242765,Somewhat-Bullish,[]
AAPL,Better Buy: Amazon vs. Apple,https://www.fool.com/investing/2023/11/15/better-buy-amazon-vs-apple/,20231115T150000,['Dani Cook'],"These companies dominate their respective markets, but one is offering investors far more value.",https://media.ycharts.com/charts/8641dded7247914becaaac738035980a.png,Motley Fool,,www.fool.com,"[{'topic': 'Economy - Monetary', 'relevance_score': '0.158519'}, {'topic': 'Retail & Wholesale', 'relevance_score': '0.5'}, {'topic': 'Financial Markets', 'relevance_score': '0.503496'}, {'topic': 'Earnings', 'relevance_score': '0.650727'}, {'topic': 'Technology', 'relevance_score': '0.5'}]",0.322069,Somewhat-Bullish,[]
AAPL,Berkshire's Buys and Sells Included a Mystery Move,https://www.barrons.com/amp/articles/warren-buffett-berkshire-hathaway-13f-stock-buy-sell-0838b6d1,20231115T145500,"['Brian Swint', 'Andrew Bary']",Berkshire Hathaway's Stock Buys and Sells Included One Mystery Move ...,https://images.barrons.com/im-732053/social,Barrons,,www.barrons.com,"[{'topic': 'Life Sciences', 'relevance_score': '0.2'}, {'topic': 'Financial Markets', 'relevance_score': '0.998962'}, {'topic': 'Manufacturing', 'relevance_score': '0.2'}, {'topic': 'Energy & Transportation', 'relevance_score': '0.2'}, {'topic': 'Technology', 'relevance_score': '0.2'}, {'topic': 'Finance', 'relevance_score': '0.2'}]",0.202543,Somewhat-Bullish,[]
AAPL,US lawmakers question Apple over Jon Stewart's China content,https://www.reuters.com/business/media-telecom/us-lawmakers-question-apple-over-jon-stewarts-china-content-2023-11-15/,20231115T145400,"['Patricia Zengerle', 'Michael Martina']","Comedian and talk show host Jon Stewart arrives on the red carpet before receiving the Mark Twain Prize For American Humor, at The Kennedy Center in Washington, U.S., April 24 2022. REUTERS/Cheriss May/File Photo Acquire Licensing Rights",https://s3.amazonaws.com/arc-authors/reuters/ec5a003d-dee3-4f0d-802e-d189696554a1.png,Reuters,Business,www.reuters.com,"[{'topic': 'Technology', 'relevance_score': '0.5'}, {'topic': 'Manufacturing', 'relevance_score': '0.5'}]",0.128268,Neutral,[]
AAPL,"Music Licensing, Inc. Announces Licensing Enforcement & Collection Litigation Campaign, and Common Stock Buyback Program",https://markets.businessinsider.com/news/stocks/music-licensing-inc.-announces-licensing-enforcement-collection-litigation-campaign-and-common-stock-buyback-program-1032823182,20231115T140600,['NEWSFILE'],"Naples, Florida-- ( Newsfile Corp. - November 15, 2023 ) - Music Licensing, Inc. ( OTC Pink: SONG ) , a leading player in the music licensing industry, today announced the commencement of a licensing enforcement and collection litigation campaign, coupled with the launch of a common stock ...",https://api.newsfilecorp.com/newsinfo/187475/208,Business Insider,RSS,markets.businessinsider.com,"[{'topic': 'Earnings', 'relevance_score': '0.360215'}, {'topic': 'Technology', 'relevance_score': '1.0'}, {'topic': 'Financial Markets', 'relevance_score': '0.976913'}]",0.351488,Bullish,[]
AAPL,"Apple And Google Could Face Consumption Tax Liability On Foreign Apps In Japan - Alphabet  ( NASDAQ:GOOG ) , Apple  ( NASDAQ:AAPL ) ",https://www.benzinga.com/news/23/11/35803758/apple-and-google-could-face-consumption-tax-liability-on-foreign-apps-in-japan,20231115T135114,['Benzinga Neuro'],"In a significant move, Japan's government has proposed that Apple Inc. AAPL and Alphabet Inc.'s GOOG GOOGL Google, be held responsible for paying consumption taxes on foreign apps.",https://cdn.benzinga.com/files/images/story/2023/Apple--Image-Via-Shutterstock.jpeg?width=1200&height=800&fit=crop,Benzinga,News,www.benzinga.com,"[{'topic': 'Technology', 'relevance_score': '1.0'}]",0.139105,Neutral,[]
AAPL,Futures Rise Ahead Of Key Inflation Data,https://www.investors.com/market-trend/stock-market-today/dow-jones-futures-key-inflation-data-targets-surges-on-earnings/,20231115T132100,"['SCOTT LEHTONEN', ""Investor's Business Daily""]","Dow Jones futures tried to keep the party going with solid gains in premarket action Wednesday as the markets awaited more inflation data. Meanwhile, retail figures were also on tap, just as industry giant Target ( TGT ) surged on strong earnings results.",https://www.investors.com/wp-content/uploads/2017/02/stock-wallStreet-1-shutter.jpg,Investors Business Daily,,www.investors.com,"[{'topic': 'Technology', 'relevance_score': '0.2'}, {'topic': 'Finance', 'relevance_score': '0.2'}, {'topic': 'Economy - Monetary', 'relevance_score': '0.682689'}, {'topic': 'Retail & Wholesale', 'relevance_score': '0.2'}, {'topic': 'Financial Markets', 'relevance_score': '1.0'}, {'topic': 'Manufacturing', 'relevance_score': '0.2'}, {'topic': 'Earnings', 'relevance_score': '0.682689'}, {'topic': 'Real Estate & Construction', 'relevance_score': '0.2'}]",0.232593,Somewhat-Bullish,[]
AAPL,The Grinch may steal holiday cheer from these consumer tech companies,https://www.marketwatch.com/story/the-grinch-may-steal-holiday-cheer-from-these-consumer-tech-companies-5208f26e,20231115T130500,['Therese Poletti'],"The Grinch is expected to steal some holiday cheer for several consumer-focused tech companies, in what is normally their strongest quarter.",https://images.mktw.net/im-886967/social,MarketWatch,Top Stories,www.marketwatch.com,"[{'topic': 'Economy - Monetary', 'relevance_score': '0.451494'}, {'topic': 'Retail & Wholesale', 'relevance_score': '0.333333'}, {'topic': 'Manufacturing', 'relevance_score': '0.333333'}, {'topic': 'Earnings', 'relevance_score': '0.938793'}, {'topic': 'Technology', 'relevance_score': '0.333333'}]",0.0,Neutral,[]
AAPL,"Apple, PepsiCo And 2 Other Stocks Insiders Are Selling - Apple  ( NASDAQ:AAPL ) , Gartner  ( NYSE:IT ) ",https://www.benzinga.com/news/23/11/35802372/apple-pepsico-and-2-other-stocks-insiders-are-selling,20231115T130250,['Lisa Levin'],"The Nasdaq 100 closed higher by over 2% on Tuesday. Investors, meanwhile, focused on some notable insider trades. When insiders sell shares, it could be a preplanned sale, or could indicate their concern in the company's prospects or that they view the stock as being overpriced.",https://cdn.benzinga.com/files/images/story/2023/11/15/apple_-_logo.jpg?width=1200&height=800&fit=crop,Benzinga,Trading,www.benzinga.com,"[{'topic': 'Technology', 'relevance_score': '0.5'}, {'topic': 'Financial Markets', 'relevance_score': '0.214378'}, {'topic': 'Manufacturing', 'relevance_score': '0.5'}]",0.138962,Neutral,[]
AAPL,Forget Nvidia. Top Funds Invest 10 Times As Much In Amazon Stock.,https://www.investors.com/research/breakout-stocks-technical-analysis/amazon-stock-top-funds-invest-10-times-as-much-in-amazon-as-in-nvidia-stock/,20231115T130100,"[""Investor's Business Daily"", 'MATTHEW GALGANI']","Last month, the best mutual funds bet big on Nvidia ( NVDA ) , scooping up more than $1.6 billion worth of the stock. But this month, Amazon.com ( AMZN ) snatched the crown as the AI Wall Street darling.",https://www.investors.com/wp-content/uploads/2023/11/Stock-angrylion-01-adobe.jpg,Investors Business Daily,,www.investors.com,"[{'topic': 'Retail & Wholesale', 'relevance_score': '0.333333'}, {'topic': 'Financial Markets', 'relevance_score': '0.999612'}, {'topic': 'Manufacturing', 'relevance_score': '0.333333'}, {'topic': 'Earnings', 'relevance_score': '0.714479'}, {'topic': 'Technology', 'relevance_score': '0.333333'}]",0.273807,Somewhat-Bullish,[]
AAPL,How much thematic exposure do stock-market investors have? Here's what BlackRock found.,https://www.marketwatch.com/story/how-much-thematic-exposure-do-stock-market-investors-have-heres-what-blackrock-found-f469bb9b,20231115T130100,['Christine Idzelis'],"The dominant ""Magnificent Seven"" stocks in S&P 500 may have some investors expecting that they're ""well exposed"" to thematic growth in their portfolios, but that might not be the case, according to BlackRock.",https://images.mktw.net/im-22882122?width=700&height=383,MarketWatch,Top Stories,www.marketwatch.com,"[{'topic': 'Financial Markets', 'relevance_score': '0.988787'}, {'topic': 'Manufacturing', 'relevance_score': '0.333333'}, {'topic': 'Technology', 'relevance_score': '0.333333'}, {'topic': 'Finance', 'relevance_score': '0.333333'}]",0.234308,Somewhat-Bullish,[]
AAPL,"mophie debuts a new version of the 3-in-1 travel charger with MagSafe, which redefined portable charging convenience for Apple users",https://www.benzinga.com/pressreleases/23/11/g35802292/mophie-debuts-a-new-version-of-the-3-in-1-travel-charger-with-magsafe-which-redefined-portable-cha,20231115T130026,['Globe Newswire'],"SALT LAKE CITY, Nov. 15, 2023 ( GLOBE NEWSWIRE ) -- mophie®, a leading brand in power, today announced a new version of the 3-in-1 travel charger with MagSafe, the company's best-selling multi-device travel charger. The 3-in-1 travel charger with MagSafe can provide up to 15W of fast-charging ...",https://www.benzinga.com/next-assets/images/schema-image-default.png,Benzinga,General,www.benzinga.com,"[{'topic': 'Technology', 'relevance_score': '0.5'}, {'topic': 'Retail & Wholesale', 'relevance_score': '0.5'}]",0.326582,Somewhat-Bullish,[]
AAPL,Analysis: 3 things to know about the most important relationship in the global economy | Business,https://www.cnn.com/2023/11/15/economy/us-china-key-issues-apec-summit-intl-hnk/index.html,20231115T130000,['Michelle Toh'],3 things to know about the most important relationship in the global economy ...,"https://media.cnn.com/api/v1/images/stellar/prod/231114092022-02-us-china-trade.jpg?q=w_1110,c_fill",CNN,Economy,www.cnn.com,"[{'topic': 'Economy - Fiscal', 'relevance_score': '0.158519'}, {'topic': 'Financial Markets', 'relevance_score': '0.623304'}, {'topic': 'Manufacturing', 'relevance_score': '0.5'}, {'topic': 'Technology', 'relevance_score': '0.5'}]",0.038174,Neutral,[]
AAPL,3 Growth Mutual Funds to Buy as Inflation Eases,https://www.zacks.com/stock/news/2184426/3-growth-mutual-funds-to-buy-as-inflation-eases,20231115T125600,['Zacks Equity Research'],"Flat CPI data fuel opportunities in growth mutual funds such as DREVX, PEMGX and NSGRX.",https://staticx-tuner.zacks.com/images/articles/main/ad/591.jpg,Zacks Commentary,,www.zacks.com,"[{'topic': 'Economy - Monetary', 'relevance_score': '0.576289'}, {'topic': 'Retail & Wholesale', 'relevance_score': '0.25'}, {'topic': 'Financial Markets', 'relevance_score': '0.972756'}, {'topic': 'Manufacturing', 'relevance_score': '0.25'}, {'topic': 'Real Estate & Construction', 'relevance_score': '0.25'}, {'topic': 'Technology', 'relevance_score': '0.25'}]",0.246973,Somewhat-Bullish,[]
AAPL,"Got $1,000? Here Are 4 Artificial Intelligence Stocks to Buy Hand Over Fist, to Help You Retire a Millionaire.",https://www.fool.com/investing/2023/11/15/got-1000-here-are-4-artificial-intelligence-stocks/,20231115T125000,['Adam Spatacco'],"These four members of the ""Magnificent Seven"" could help you retire a millionaire.",https://g.foolcdn.com/image/?url=https%3A%2F%2Fg.foolcdn.com%2Feditorial%2Fimages%2F753062%2Fsocial-media-scrolling-on-phone-networking.jpg&op=resize&w=700,Motley Fool,,www.fool.com,"[{'topic': 'Retail & Wholesale', 'relevance_score': '0.333333'}, {'topic': 'Financial Markets', 'relevance_score': '0.266143'}, {'topic': 'Manufacturing', 'relevance_score': '0.333333'}, {'topic': 'Earnings', 'relevance_score': '0.997874'}, {'topic': 'Technology', 'relevance_score': '0.333333'}]",0.276386,Somewhat-Bullish,[]
AAPL,2 Hot Stocks to Buy and Hold Until You Retire,https://www.fool.com/investing/2023/11/15/2-hot-stocks-to-buy-and-hold-until-you-retire/,20231115T121500,['Dani Cook'],"The tech industry is booming, and these companies are well-positioned to see major gains over the long term.",https://media.ycharts.com/charts/8f6c45e7186e8c82a706f6b1dbf5f51d.png,Motley Fool,,www.fool.com,"[{'topic': 'Financial Markets', 'relevance_score': '0.980922'}, {'topic': 'Manufacturing', 'relevance_score': '0.5'}, {'topic': 'Earnings', 'relevance_score': '0.161647'}, {'topic': 'Technology', 'relevance_score': '0.5'}]",0.231693,Somewhat-Bullish,[]
AAPL,"Got $1,000? 3 Warren Buffett Stocks to Buy Hand Over Fist",https://www.fool.com/investing/2023/11/15/got-1000-3-warren-buffett-stocks-buy-hand-fist/,20231115T114500,['Will Healy'],"Yes, you can invest like Warren Buffett's team on a modest budget.",https://g.foolcdn.com/misc-assets/hp-sa-cumulative-growth-chart.png,Motley Fool,,www.fool.com,"[{'topic': 'Retail & Wholesale', 'relevance_score': '0.333333'}, {'topic': 'Financial Markets', 'relevance_score': '0.99793'}, {'topic': 'Earnings', 'relevance_score': '0.972476'}, {'topic': 'Technology', 'relevance_score': '0.333333'}, {'topic': 'Finance', 'relevance_score': '0.333333'}]",0.149747,Neutral,[]
AAPL,"Hedge-fund manager who called last year's tech crash bets on Florida, oil drillers and this commodity",https://www.marketwatch.com/story/hedge-fund-manager-who-called-last-years-tech-crash-bets-on-florida-oil-drillers-and-this-commodity-aa13443c,20231115T114300,['Barbara Kollmeyer'],"Harris Kupperman, founder of hedge fund Praetorian Capital, says uranium, Florida and oil service companies are the best bets going right now.",https://images.mktw.net/im-43046052?width=700&height=461,MarketWatch,Top Stories,www.marketwatch.com,"[{'topic': 'Energy & Transportation', 'relevance_score': '0.2'}, {'topic': 'Technology', 'relevance_score': '0.2'}, {'topic': 'Finance', 'relevance_score': '0.2'}, {'topic': 'Economy - Monetary', 'relevance_score': '0.158519'}, {'topic': 'Retail & Wholesale', 'relevance_score': '0.2'}, {'topic': 'Financial Markets', 'relevance_score': '0.989041'}, {'topic': 'Manufacturing', 'relevance_score': '0.2'}, {'topic': 'Earnings', 'relevance_score': '0.158519'}]",0.085862,Neutral,[]
