symbol,title,url,time_published,authors,summary,banner_image,source,category_within_source,source_domain,topics,overall_sentiment_score,overall_sentiment_label,ticker_sentiments
MSFT,"Market Clubhouse Morning Memo - November 15th, 2023  ( Trade Strategy For SPY, QQQ, AAPL, MSFT, NVDA, META, TSLA, And GOOGL )  - Invesco QQQ Trust, Series 1  ( NASDAQ:QQQ ) ",https://www.benzinga.com/trading-ideas/23/11/35808078/market-clubhouse-morning-memo-november-15th-2023-trade-strategy-for-spy-qqq-aapl-msft-nvda-meta-tsl,20231115T155337,['RIPS'],"Good Morning Traders! In today's Market Clubhouse Morning Memo, we will discuss SPY, QQQ, AAPL, MSFT, NVDA, META, TSLA, and GOOGL. Our proprietary formula, exclusive to Market Clubhouse, dictates these price levels. This dynamic equation takes into account price, volume, and options flow.",https://cdn.benzinga.com/files/market-clubhouse-morning-memo_109.png?width=1200&height=800&fit=crop,Benzinga,Markets,www.benzinga.com,"[{'topic': 'Economy - Monetary', 'relevance_score': '0.158519'}, {'topic': 'Financial Markets', 'relevance_score': '0.996023'}, {'topic': 'Manufacturing', 'relevance_score': '0.5'}, {'topic': 'Technology', 'relevance_score': '0.5'}]",0.220593,Somewhat-Bullish,[]
MSFT,"A Taylor Swift song is the best investment advice for 2024, Goldman Sachs says",https://markets.businessinsider.com/news/stocks/taylor-swift-song-best-2024-investment-advice-stock-market-outlook-2023-11,20231115T153900,['Matthew Fox'],Taylor Swift Song Is the Best Investment Advice for 2024: Goldman Sachs - Markets Insider ...,,Business Insider,GoogleRSS,markets.businessinsider.com,"[{'topic': 'Economy - Monetary', 'relevance_score': '0.158519'}, {'topic': 'Financial Markets', 'relevance_score': '0.962106'}, {'topic': 'Manufacturing', 'relevance_score': '0.333333'}, {'topic': 'Technology', 'relevance_score': '0.333333'}, {'topic': 'Finance', 'relevance_score': '0.333333'}]",0.325719,Somewhat-Bullish,[]
MSFT,Wholesale Inflation Lower Than Expected But Retail Sales Data Creates A Rethink In The Stock Market - Target  ( NYSE:TGT ) ,https://www.benzinga.com/markets/23/11/35807623/wholesale-inflation-lower-than-expected-but-retail-sales-data-creates-a-rethink-in-the-stock-market,20231115T153734,['The Arora Report'],"To gain an edge, this is what you need to know today. Please click here for a chart of SPDR S&P 500 ETF Trust SPY which represents the benchmark stock market index S&P 500 ( SPX ) . Headline PPI came at -0.5% vs. 0.1% consensus. This is the biggest decline since April 2020.",https://cdn.benzinga.com/files/yiorgos-ntrahas-mcauhlgirvs-unsplash_8_9.jpg?width=1200&height=800&fit=crop,Benzinga,Trading,www.benzinga.com,"[{'topic': 'Technology', 'relevance_score': '0.2'}, {'topic': 'Finance', 'relevance_score': '0.2'}, {'topic': 'Economy - Monetary', 'relevance_score': '0.158519'}, {'topic': 'Retail & Wholesale', 'relevance_score': '0.2'}, {'topic': 'Financial Markets', 'relevance_score': '0.999894'}, {'topic': 'Manufacturing', 'relevance_score': '0.2'}, {'topic': 'Earnings', 'relevance_score': '0.795202'}, {'topic': 'Real Estate & Construction', 'relevance_score': '0.2'}]",0.242765,Somewhat-Bullish,[]
MSFT,We Pack Logistics chooses Nulogy to digitally enable co-pack growth and agility - PR Newswire,https://www.prnewswire.com/news-releases/we-pack-logistics-chooses-nulogy-to-digitally-enable-co-pack-growth-and-agility-301987736.html,20231115T153000,[],We Pack Logistics chooses Nulogy to digitally enable co-pack growth and agility PR ...,,PR Newswire,n/a,www.prnewswire.com,"[{'topic': 'Life Sciences', 'relevance_score': '0.5'}, {'topic': 'Technology', 'relevance_score': '0.5'}]",0.348849,Somewhat-Bullish,[]
MSFT,We Pack Logistics chooses Nulogy to digitally enable co-pack growth and agility - Canada NewsWire,https://www.newswire.ca/news-releases/we-pack-logistics-chooses-nulogy-to-digitally-enable-co-pack-growth-and-agility-873524082.html,20231115T153000,[],We Pack Logistics chooses Nulogy to digitally enable co-pack growth and agility Canada ...,,Canada Newswire,n/a,www.newswire.ca,"[{'topic': 'Life Sciences', 'relevance_score': '0.5'}, {'topic': 'Technology', 'relevance_score': '0.5'}]",0.338289,Somewhat-Bullish,[]
MSFT,Jamf is a Proud Participant in the Microsoft Security Copilot Partner Private Preview,https://www.globenewswire.com/news-release/2023/11/15/2781178/0/en/Jamf-is-a-Proud-Participant-in-the-Microsoft-Security-Copilot-Partner-Private-Preview.html,20231115T150500,['Jamf'],"MINNEAPOLIS, Nov. 15, 2023 ( GLOBE NEWSWIRE ) -- Jamf ( NASDAQ: JAMF ) today announced its participation in the Microsoft Security Copilot Partner Private Preview. Jamf was selected based on their proven experience with Microsoft Security technologies, willingness to explore and provide feedback ...",https://ml.globenewswire.com/Resource/Download/bb6558d6-bcb0-4f2d-b711-96c26bab4024,GlobeNewswire,n/a,www.globenewswire.com,"[{'topic': 'Technology', 'relevance_score': '1.0'}]",0.38353,Bullish,[]
MSFT,Better Buy: Amazon vs. Apple,https://www.fool.com/investing/2023/11/15/better-buy-amazon-vs-apple/,20231115T150000,['Dani Cook'],"These companies dominate their respective markets, but one is offering investors far more value.",https://media.ycharts.com/charts/8641dded7247914becaaac738035980a.png,Motley Fool,n/a,www.fool.com,"[{'topic': 'Economy - Monetary', 'relevance_score': '0.158519'}, {'topic': 'Retail & Wholesale', 'relevance_score': '0.5'}, {'topic': 'Financial Markets', 'relevance_score': '0.503496'}, {'topic': 'Earnings', 'relevance_score': '0.650727'}, {'topic': 'Technology', 'relevance_score': '0.5'}]",0.322069,Somewhat-Bullish,[]
AMZN,Amazon gets FDA warning on sale of unapproved eye drops,https://www.marketwatch.com/story/amazon-gets-fda-warning-on-sale-of-unapproved-eye-drops-71dc6c2a,20231115T165300,['Eleanor Laise'],Warning is latest in series of regulatory actions on over-the-counter eye products.,https://images.mktw.net/im-352020 im-351083,MarketWatch,Top Stories,www.marketwatch.com,"[{'topic': 'Retail & Wholesale', 'relevance_score': '1.0'}]",-0.115927,Neutral,[]
AMZN,10 stocks of consumer companies expected to grow sales the fastest through 2025,https://www.marketwatch.com/story/10-stocks-of-consumer-companies-expected-to-grow-sales-the-fastest-through-2025-1fab18da,20231115T161300,['Philip van Doorn'],Ten companies in the S&P 500 consumer-discretionary sector that analysts expect to increase revenue most quickly from 2023 through 2025.,https://images.mktw.net/im-36074581?width=700&height=609,MarketWatch,Top Stories,www.marketwatch.com,"[{'topic': 'Retail & Wholesale', 'relevance_score': '0.333333'}, {'topic': 'Financial Markets', 'relevance_score': '0.796627'}, {'topic': 'Manufacturing', 'relevance_score': '0.333333'}, {'topic': 'Earnings', 'relevance_score': '0.993781'}, {'topic': 'Real Estate & Construction', 'relevance_score': '0.333333'}]",0.021444,Neutral,[]
AMZN,Paramount Global  ( PARA )  Unveils Trailer of BABY SHARK'S BIG MOVIE,https://www.zacks.com/stock/news/2184701/paramount-global-para-unveils-trailer-of-baby-sharks-big-movie,20231115T154700,['Zacks Equity Research'],"Paramount Global (PARA) reveals the official trailer of BABY SHARK'S BIG MOVIE, which is set to release on Dec 8.",https://staticx-tuner.zacks.com/images/articles/main/51/5120.jpg,Zacks Commentary,n/a,www.zacks.com,"[{'topic': 'Retail & Wholesale', 'relevance_score': '0.5'}, {'topic': 'Technology', 'relevance_score': '0.5'}]",0.310764,Somewhat-Bullish,[]
AMZN,Better Buy: Amazon vs. Apple,https://www.fool.com/investing/2023/11/15/better-buy-amazon-vs-apple/,20231115T150000,['Dani Cook'],"These companies dominate their respective markets, but one is offering investors far more value.",https://media.ycharts.com/charts/8641dded7247914becaaac738035980a.png,Motley Fool,n/a,www.fool.com,"[{'topic': 'Economy - Monetary', 'relevance_score': '0.158519'}, {'topic': 'Retail & Wholesale', 'relevance_score': '0.5'}, {'topic': 'Financial Markets', 'relevance_score': '0.503496'}, {'topic': 'Earnings', 'relevance_score': '0.650727'}, {'topic': 'Technology', 'relevance_score': '0.5'}]",0.322069,Somewhat-Bullish,[]
AMZN,"Amazon.com, Inc.  ( AMZN )  Soars to 52-Week High, Time to Cash Out?",https://www.zacks.com/stock/news/2184553/amazoncom-inc-amzn-soars-to-52-week-high-time-to-cash-out,20231115T141512,['Zacks Equity Research'],"Amazon (AMZN) is at a 52-week high, but can investors hope for more gains in the future? We take a look at the company's fundamentals for clues.",https://staticx-tuner.zacks.com/images/default_article_images/default346.jpg,Zacks Commentary,n/a,www.zacks.com,"[{'topic': 'Earnings', 'relevance_score': '0.996718'}, {'topic': 'Retail & Wholesale', 'relevance_score': '1.0'}, {'topic': 'Financial Markets', 'relevance_score': '0.365926'}]",0.297746,Somewhat-Bullish,[]
AMZN,Futures Rise Ahead Of Key Inflation Data,https://www.investors.com/market-trend/stock-market-today/dow-jones-futures-key-inflation-data-targets-surges-on-earnings/,20231115T132100,"['SCOTT LEHTONEN', ""Investor's Business Daily""]","Dow Jones futures tried to keep the party going with solid gains in premarket action Wednesday as the markets awaited more inflation data. Meanwhile, retail figures were also on tap, just as industry giant Target ( TGT ) surged on strong earnings results.",https://www.investors.com/wp-content/uploads/2017/02/stock-wallStreet-1-shutter.jpg,Investors Business Daily,n/a,www.investors.com,"[{'topic': 'Technology', 'relevance_score': '0.2'}, {'topic': 'Finance', 'relevance_score': '0.2'}, {'topic': 'Economy - Monetary', 'relevance_score': '0.682689'}, {'topic': 'Retail & Wholesale', 'relevance_score': '0.2'}, {'topic': 'Financial Markets', 'relevance_score': '1.0'}, {'topic': 'Manufacturing', 'relevance_score': '0.2'}, {'topic': 'Earnings', 'relevance_score': '0.682689'}, {'topic': 'Real Estate & Construction', 'relevance_score': '0.2'}]",0.232593,Somewhat-Bullish,[]
AMZN,The Grinch may steal holiday cheer from these consumer tech companies,https://www.marketwatch.com/story/the-grinch-may-steal-holiday-cheer-from-these-consumer-tech-companies-5208f26e,20231115T130500,['Therese Poletti'],"The Grinch is expected to steal some holiday cheer for several consumer-focused tech companies, in what is normally their strongest quarter.",https://images.mktw.net/im-886967/social,MarketWatch,Top Stories,www.marketwatch.com,"[{'topic': 'Economy - Monetary', 'relevance_score': '0.451494'}, {'topic': 'Retail & Wholesale', 'relevance_score': '0.333333'}, {'topic': 'Manufacturing', 'relevance_score': '0.333333'}, {'topic': 'Earnings', 'relevance_score': '0.938793'}, {'topic': 'Technology', 'relevance_score': '0.333333'}]",0.0,Neutral,[]
AMZN,Forget Nvidia. Top Funds Invest 10 Times As Much In Amazon Stock.,https://www.investors.com/research/breakout-stocks-technical-analysis/amazon-stock-top-funds-invest-10-times-as-much-in-amazon-as-in-nvidia-stock/,20231115T130100,"[""Investor's Business Daily"", 'MATTHEW GALGANI']","Last month, the best mutual funds bet big on Nvidia ( NVDA ) , scooping up more than $1.6 billion worth of the stock. But this month, Amazon.com ( AMZN ) snatched the crown as the AI Wall Street darling.",https://www.investors.com/wp-content/uploads/2023/11/Stock-angrylion-01-adobe.jpg,Investors Business Daily,n/a,www.investors.com,"[{'topic': 'Retail & Wholesale', 'relevance_score': '0.333333'}, {'topic': 'Financial Markets', 'relevance_score': '0.999612'}, {'topic': 'Manufacturing', 'relevance_score': '0.333333'}, {'topic': 'Earnings', 'relevance_score': '0.714479'}, {'topic': 'Technology', 'relevance_score': '0.333333'}]",0.273807,Somewhat-Bullish,[]
AMZN,SNAP Shares Rise 8% on Deal to Sell Amazon Products on App,https://www.zacks.com/stock/news/2184436/snap-shares-rise-8-on-deal-to-sell-amazon-products-on-app,20231115T125800,['Zacks Equity Research'],"SNAP enters into a deal with Amazon, which allows Snapchat users in the United States to buy products from the online retailer without leaving the app.",https://staticx-tuner.zacks.com/images/articles/main/f8/30109.jpg,Zacks Commentary,n/a,www.zacks.com,"[{'topic': 'Retail & Wholesale', 'relevance_score': '0.5'}, {'topic': 'Technology', 'relevance_score': '0.5'}]",0.267561,Somewhat-Bullish,[]
AMZN,"Got $1,000? Here Are 4 Artificial Intelligence Stocks to Buy Hand Over Fist, to Help You Retire a Millionaire.",https://www.fool.com/investing/2023/11/15/got-1000-here-are-4-artificial-intelligence-stocks/,20231115T125000,['Adam Spatacco'],"These four members of the ""Magnificent Seven"" could help you retire a millionaire.",https://g.foolcdn.com/image/?url=https%3A%2F%2Fg.foolcdn.com%2Feditorial%2Fimages%2F753062%2Fsocial-media-scrolling-on-phone-networking.jpg&op=resize&w=700,Motley Fool,n/a,www.fool.com,"[{'topic': 'Retail & Wholesale', 'relevance_score': '0.333333'}, {'topic': 'Financial Markets', 'relevance_score': '0.266143'}, {'topic': 'Manufacturing', 'relevance_score': '0.333333'}, {'topic': 'Earnings', 'relevance_score': '0.997874'}, {'topic': 'Technology', 'relevance_score': '0.333333'}]",0.276386,Somewhat-Bullish,[]
AMZN,Oracle  ( ORCL )  Adds Healthcare Inventory Management Capabilities,https://www.zacks.com/stock/news/2184422/oracle-orcl-adds-healthcare-inventory-management-capabilities,20231115T124800,['Zacks Equity Research'],"Oracle (ORCL) boosts efforts to enhance inventory management capabilities within its Fusion Cloud Inventory Management, particularly for healthcare organizations.",https://staticx-tuner.zacks.com/images/articles/main/79/525.jpg,Zacks Commentary,n/a,www.zacks.com,"[{'topic': 'Retail & Wholesale', 'relevance_score': '0.5'}, {'topic': 'Technology', 'relevance_score': '0.5'}, {'topic': 'Financial Markets', 'relevance_score': '0.161647'}]",0.219653,Somewhat-Bullish,[]
AMZN,1 Incredible Artificial Intelligence  ( AI )  Stock to Buy Not Named Nvidia,https://www.fool.com/investing/2023/11/15/1-incredible-artificial-intelligence-ai-stock-to-b/,20231115T121000,['Adam Spatacco'],AMD's Q3 earnings looked pretty good -- but its outlook for 2024 is downright awesome.,https://g.foolcdn.com/image/?url=https%3A%2F%2Fg.foolcdn.com%2Feditorial%2Fimages%2F753607%2Fscreenshot-2023-11-13-114255.png&op=resize&w=700,Motley Fool,n/a,www.fool.com,"[{'topic': 'Economy - Monetary', 'relevance_score': '0.158519'}, {'topic': 'Retail & Wholesale', 'relevance_score': '0.333333'}, {'topic': 'Financial Markets', 'relevance_score': '0.999976'}, {'topic': 'Manufacturing', 'relevance_score': '0.333333'}, {'topic': 'Earnings', 'relevance_score': '0.99737'}, {'topic': 'Technology', 'relevance_score': '0.333333'}]",0.298933,Somewhat-Bullish,[]
AMZN,"Got $1,000? 3 Warren Buffett Stocks to Buy Hand Over Fist",https://www.fool.com/investing/2023/11/15/got-1000-3-warren-buffett-stocks-buy-hand-fist/,20231115T114500,['Will Healy'],"Yes, you can invest like Warren Buffett's team on a modest budget.",https://g.foolcdn.com/misc-assets/hp-sa-cumulative-growth-chart.png,Motley Fool,n/a,www.fool.com,"[{'topic': 'Retail & Wholesale', 'relevance_score': '0.333333'}, {'topic': 'Financial Markets', 'relevance_score': '0.99793'}, {'topic': 'Earnings', 'relevance_score': '0.972476'}, {'topic': 'Technology', 'relevance_score': '0.333333'}, {'topic': 'Finance', 'relevance_score': '0.333333'}]",0.149747,Neutral,[]
AMZN,"Hedge-fund manager who called last year's tech crash bets on Florida, oil drillers and this commodity",https://www.marketwatch.com/story/hedge-fund-manager-who-called-last-years-tech-crash-bets-on-florida-oil-drillers-and-this-commodity-aa13443c,20231115T114300,['Barbara Kollmeyer'],"Harris Kupperman, founder of hedge fund Praetorian Capital, says uranium, Florida and oil service companies are the best bets going right now.",https://images.mktw.net/im-43046052?width=700&height=461,MarketWatch,Top Stories,www.marketwatch.com,"[{'topic': 'Energy & Transportation', 'relevance_score': '0.2'}, {'topic': 'Technology', 'relevance_score': '0.2'}, {'topic': 'Finance', 'relevance_score': '0.2'}, {'topic': 'Economy - Monetary', 'relevance_score': '0.158519'}, {'topic': 'Retail & Wholesale', 'relevance_score': '0.2'}, {'topic': 'Financial Markets', 'relevance_score': '0.989041'}, {'topic': 'Manufacturing', 'relevance_score': '0.2'}, {'topic': 'Earnings', 'relevance_score': '0.158519'}]",0.085862,Neutral,[]
AMZN,"Could Your Eye Drops Be Unsafe? FDA Flags Amazon For Distributing Risky Eye Products, Demands Immediate Action - Target  ( NYSE:TGT ) , Rite Aid  ( OTC:RADCQ ) , CVS Health  ( NYSE:CVS ) , Cardinal Health  ( NYSE:CAH ) ",https://www.benzinga.com/markets/equities/23/11/35798315/could-your-eye-drops-be-unsafe-fda-flags-amazon-for-distributing-risky-eye-products-demands-imme,20231115T111939,['Nabaparna Bhattacharya'],"Amazon.Com, Inc. AMZN has received a warning from the U.S. Food and Drug Administration for selling and distributing certain unapproved eye drops, as these products are especially concerning from a public health perspective.",https://cdn.benzinga.com/files/images/story/2023/11/15/amzn_3.png?width=1200&height=800&fit=crop,Benzinga,General,www.benzinga.com,"[{'topic': 'Retail & Wholesale', 'relevance_score': '1.0'}, {'topic': 'Financial Markets', 'relevance_score': '0.108179'}]",-0.022213,Neutral,[]
AMZN,3 Warren Buffett Stocks With Strong Moats to Buy Right Now,https://www.fool.com/investing/2023/11/15/3-warren-buffett-stocks-with-strong-moats-to-buy-r/,20231115T111500,['Keith Speights'],These Buffett stocks are definitely built for the long term.,https://g.foolcdn.com/misc-assets/hp-sa-cumulative-growth-chart.png,Motley Fool,n/a,www.fool.com,"[{'topic': 'Retail & Wholesale', 'relevance_score': '0.5'}, {'topic': 'Earnings', 'relevance_score': '0.947132'}, {'topic': 'Finance', 'relevance_score': '0.5'}, {'topic': 'Economy - Macro', 'relevance_score': '0.158519'}]",0.303392,Somewhat-Bullish,[]
AMZN,3 Moves to Make if the Stock Market Plummets Tomorrow,https://www.fool.com/investing/2023/11/15/3-moves-to-make-if-the-stock-market-plummets/,20231115T103000,['Adria Cimino'],These steps could boost your long-term performance.,https://g.foolcdn.com/image/?url=https%3A%2F%2Fg.foolcdn.com%2Feditorial%2Fimages%2F755036%2Fgettyimages-1316264191.jpg&op=resize&w=700,Motley Fool,n/a,www.fool.com,"[{'topic': 'Life Sciences', 'relevance_score': '0.333333'}, {'topic': 'Retail & Wholesale', 'relevance_score': '0.333333'}, {'topic': 'Financial Markets', 'relevance_score': '0.962106'}, {'topic': 'Manufacturing', 'relevance_score': '0.333333'}, {'topic': 'Earnings', 'relevance_score': '0.158519'}]",0.064078,Neutral,[]
AMZN,"Amazon Blocks Promotions For Employees Defying Return-To-Office Policy, Leaked Documents Reveal - Amazon.com  ( NASDAQ:AMZN ) ",https://www.benzinga.com/news/23/11/35799060/amazon-blocks-promotions-for-employees-defying-return-to-office-policy-leaked-documents-reveal,20231115T101116,['Benzinga Neuro'],"In a significant shift in its promotion eligibility norms, Amazon Inc. AMZN has decided to link adherence to its return-to-office ( RTO ) policy with the possibility of promotions. Non-compliance could potentially stall promotions, necessitating approval from a vice president.",https://cdn.benzinga.com/files/images/story/2023/amazon-chart-shutter2.jpeg?width=1200&height=800&fit=crop,Benzinga,General,www.benzinga.com,"[{'topic': 'Retail & Wholesale', 'relevance_score': '1.0'}]",0.045158,Neutral,[]
AMZN,Forget Apple: These 2 Stocks Are Better Buys for a Bull Market,https://www.fool.com/investing/2023/11/15/forget-apple-2-stocks-better-buys-bull-market/,20231115T100000,['Adria Cimino'],All three of these stocks have gained this year.,https://g.foolcdn.com/image/?url=https%3A%2F%2Fg.foolcdn.com%2Feditorial%2Fimages%2F755035%2Fe-commerce-man-smiling-credit-card.jpg&op=resize&w=700,Motley Fool,n/a,www.fool.com,"[{'topic': 'Economy - Monetary', 'relevance_score': '0.158519'}, {'topic': 'Retail & Wholesale', 'relevance_score': '0.5'}, {'topic': 'Financial Markets', 'relevance_score': '0.316726'}, {'topic': 'Earnings', 'relevance_score': '0.998311'}, {'topic': 'Technology', 'relevance_score': '0.5'}]",0.339015,Somewhat-Bullish,[]
AMZN,Buy this not that: What to shop for and what to skip on Black Friday,https://www.marketwatch.com/story/buy-this-not-that-what-to-shop-for-and-what-to-skip-on-black-friday-this-year-78ca7f3d,20231115T100000,['Tommy Tindall'],"If you're waiting for Nov. 24 to do holiday shopping, here's a short list of what to buy (or skip) during Black Friday and Cyber Monday sales.",https://images.mktw.net/im-885387/social,MarketWatch,Top Stories,www.marketwatch.com,"[{'topic': 'Economy - Monetary', 'relevance_score': '0.158519'}, {'topic': 'Technology', 'relevance_score': '0.5'}, {'topic': 'Retail & Wholesale', 'relevance_score': '0.5'}]",0.272525,Somewhat-Bullish,[]
AMZN,"Amazon, Google And Microsoft To Invest $8.5B In Thailand's Digital Infrastructure - Alphabet  ( NASDAQ:GOOG ) , Amazon.com  ( NASDAQ:AMZN ) ",https://www.benzinga.com/news/23/11/35798088/amazon-google-and-microsoft-to-invest-8-5b-in-thailands-digital-infrastructure,20231115T085623,['Benzinga Neuro'],"Thailand is on the verge of a major financial investment from three of the world's tech giants, Amazon Web Services ( AWS ) AMZN, Google GOOGL GOOG, and Microsoft MSFT. The investment, worth a staggering $8.5 billion, is set to significantly advance the nation's digital infrastructure and ...",https://cdn.benzinga.com/files/images/story/2023/Thailand_0.jpeg?width=1200&height=800&fit=crop,Benzinga,General,www.benzinga.com,"[{'topic': 'Retail & Wholesale', 'relevance_score': '0.333333'}, {'topic': 'Financial Markets', 'relevance_score': '0.459462'}, {'topic': 'Manufacturing', 'relevance_score': '0.333333'}, {'topic': 'Technology', 'relevance_score': '0.333333'}]",0.229699,Somewhat-Bullish,[]
AMZN,"Buffett's Berkshire Trimmed Chevron Stake While Cashing Out Of GM And This COVID Stock: Here's How The Sage Of Omaha Adjusted His Portfolio In Q3 - Apple  ( NASDAQ:AAPL ) , Amazon.com  ( NASDAQ:AMZN ) ",https://www.benzinga.com/markets/equities/23/11/35797715/buffetts-berkshire-trimmed-chevron-stake-while-cashing-out-of-gm-and-this-covid-stock-heres-how-,20231115T074753,['Shanthi Rexaline'],"Billionaire investor Warren Buffett-run Berkshire Hathaway, Inc. BRK BRK maintained its core portfolio stocks largely unchanged in the third quarter but divested a slew of stocks including legacy automaker General Motors Corp. GM.",https://cdn.benzinga.com/files/images/story/2023/Warren-Buffett--Chairman-And-Ceo-Of-Berk.jpeg?width=1200&height=800&fit=crop,Benzinga,Trading,www.benzinga.com,"[{'topic': 'Life Sciences', 'relevance_score': '0.142857'}, {'topic': 'Energy & Transportation', 'relevance_score': '0.142857'}, {'topic': 'Technology', 'relevance_score': '0.142857'}, {'topic': 'Finance', 'relevance_score': '0.142857'}, {'topic': 'Retail & Wholesale', 'relevance_score': '0.142857'}, {'topic': 'Financial Markets', 'relevance_score': '0.684621'}, {'topic': 'Manufacturing', 'relevance_score': '0.142857'}, {'topic': 'Real Estate & Construction', 'relevance_score': '0.142857'}]",0.189995,Somewhat-Bullish,[]
AMZN,Tepper's Appaloosa dumps Apple stake and loads up on Amazon's stock,https://www.marketwatch.com/story/teppers-appaloosa-dumps-apple-stake-and-loads-up-on-amazons-stock-231d95b5,20231114T220200,['Ciara Linnane'],"David Tepper's Appaloosa hedge fund raised its stake in Amazon and dropped its stake in Apple, according to a filing with the Securities and Exchange Commission late Tuesday.",https://images.mktw.net/im-539864/social,MarketWatch,Top Stories,www.marketwatch.com,"[{'topic': 'Technology', 'relevance_score': '0.5'}, {'topic': 'Retail & Wholesale', 'relevance_score': '0.5'}, {'topic': 'Financial Markets', 'relevance_score': '0.158519'}]",0.280413,Somewhat-Bullish,[]
AMZN,"TikTok's New Feature: Users Can Save Viral Songs To Spotify, Apple Music, Amazon Music Directly - Spotify Technology  ( NYSE:SPOT ) , Amazon.com  ( NASDAQ:AMZN ) ",https://www.benzinga.com/general/entertainment/23/11/35789002/tiktoks-new-feature-users-can-save-viral-songs-to-spotify-apple-music-amazon-music-directly,20231114T213554,['Franca Quarneti'],"ByteDance's TikTok, the social media platform renowned for its role in launching viral songs, introduced a new feature called Add to Music App, allowing users in the U.S. and U.K. to save TikTok-discovered songs directly to Spotify Technology SPOT, Apple Inc's APPL Apple Music or Amazon.com ...",https://cdn.benzinga.com/files/images/story/2023/11/14/shutterstock_2115971435.jpg?width=1200&height=800&fit=crop,Benzinga,General,www.benzinga.com,"[{'topic': 'Economy - Monetary', 'relevance_score': '0.158519'}, {'topic': 'Retail & Wholesale', 'relevance_score': '0.5'}, {'topic': 'Technology', 'relevance_score': '0.5'}]",0.288665,Somewhat-Bullish,[]
AMZN,"Why Artificial Intelligence  ( AI )  Stocks Alphabet, Meta Platforms, Amazon, and Others Rallied Tuesday Morning",https://www.fool.com/investing/2023/11/14/why-artificial-intelligence-ai-stocks-alphabet-met/,20231114T190200,['Danny Vena'],"While Wall Street was upbeat about the improving economic landscape, a collaboration in the AI space provided additional momentum.",https://g.foolcdn.com/image/?url=https%3A%2F%2Fg.foolcdn.com%2Feditorial%2Fimages%2F755095%2Fthe-letters-ai-superimposed-over-a-circuit-board.jpg&op=resize&w=700,Motley Fool,n/a,www.fool.com,"[{'topic': 'Economy - Monetary', 'relevance_score': '0.769861'}, {'topic': 'Retail & Wholesale', 'relevance_score': '0.333333'}, {'topic': 'Financial Markets', 'relevance_score': '0.161647'}, {'topic': 'Technology', 'relevance_score': '0.333333'}, {'topic': 'Finance', 'relevance_score': '0.333333'}]",0.225593,Somewhat-Bullish,[]
