symbol,title,url,time_published,authors,summary,banner_image,source,category_within_source,source_domain,topics,overall_sentiment_score,overall_sentiment_label,ticker_sentiments
AMZN,"EXCLUSIVE: Amazon's Web3/Blockchain Head Talks Bitcoin ETF, Advances In Stablecoins, Tokenization Accelerating Institutional Adoption - Amazon.com  ( NASDAQ:AMZN ) ",https://www.benzinga.com/markets/cryptocurrency/23/11/35783777/exclusive-amazons-web3blockchain-head-talks-bitcoin-etf-advances-in-stablecoins-tokenizati,20231114T181016,['Adam Eckert'],"Crypto is the future of finance and institutions represent the roads that get us there. Amazon Exec On Bitcoin ETF: John Liu, Head of Product Web3/Blockchain at Amazon.com Inc AMZN Web Services, talked the acceleration of the crypto industry, bolstered by increasing institutional demand, on ...",https://cdn.benzinga.com/files/images/story/2023/11/14/amazonliu.jpg?width=1200&height=800&fit=crop,Benzinga,Markets,www.benzinga.com,"[{'topic': 'Retail & Wholesale', 'relevance_score': '1.0'}, {'topic': 'Blockchain', 'relevance_score': '0.983605'}, {'topic': 'Financial Markets', 'relevance_score': '0.614606'}]",0.331998,Somewhat-Bullish,[]
AMZN,Amazon's stock is about to reach a milestone not seen in 19 months,https://www.marketwatch.com/story/amazons-stock-is-about-to-reach-a-milestone-not-seen-in-19-months-39cab221,20231114T173200,['Emily Bary'],"Amazon.com hasn't been valued at upwards of $1.5 trillion since April 2022, but it's on track to cross back into that territory Tuesday.",https://images.mktw.net/im-886766/social,MarketWatch,Top Stories,www.marketwatch.com,"[{'topic': 'Retail & Wholesale', 'relevance_score': '0.333333'}, {'topic': 'Financial Markets', 'relevance_score': '0.266143'}, {'topic': 'Technology', 'relevance_score': '0.333333'}, {'topic': 'Finance', 'relevance_score': '0.333333'}]",0.177502,Somewhat-Bullish,[]
AMZN,Amazon Is Boosting C3.ai Stock Tuesday: What's Going On? - C3.ai  ( NYSE:AI ) ,https://www.benzinga.com/news/23/11/35778761/amazon-is-boosting-c3-ai-stock-tuesday-whats-going-on,20231114T172345,['Adam Eckert'],C3.Ai Inc AI shares are trading higher Tuesday after the company announced an expanded collaboration agreement with Amazon Web Services. What Happened: C3.ai expanded its strategic collaboration with Amazon.com Inc's AMZN AWS to deliver AI solutions to help customers solve business challenges.,https://cdn.benzinga.com/files/images/story/2023/11/14/delivery-vans-in-loading-lot-area-2.jpg?width=1200&height=800&fit=crop,Benzinga,News,www.benzinga.com,"[{'topic': 'Retail & Wholesale', 'relevance_score': '1.0'}, {'topic': 'Financial Markets', 'relevance_score': '0.108179'}]",0.569329,Bullish,[]
AMZN,51.4% of Warren Buffett's $348 Billion Berkshire Hathaway Portfolio Is Invested in These 2 Artificial Intelligence  ( AI )  Stocks,https://www.fool.com/investing/2023/11/14/514-of-warren-buffetts-berkshire-hathaway-portfoli/,20231114T171711,"['CFA', 'Parkev Tatevosian']",The Oracle of Omaha may have stumbled into the hottest investing trend in 2023.,https://g.foolcdn.com/misc-assets/hp-sa-cumulative-growth-chart.png,Motley Fool,n/a,www.fool.com,"[{'topic': 'Retail & Wholesale', 'relevance_score': '0.333333'}, {'topic': 'Technology', 'relevance_score': '0.333333'}, {'topic': 'Finance', 'relevance_score': '0.333333'}]",-0.355562,Bearish,[]
AMZN,"Microsoft and Google Comply with EU's New Tech Regulations, Aiming for Easier User Access Across Services - Microsoft  ( NASDAQ:MSFT ) , Alphabet  ( NASDAQ:GOOG ) , Alphabet  ( NASDAQ:GOOGL ) ",https://www.benzinga.com/government/23/11/35775905/microsoft-and-google-comply-with-eus-new-tech-regulations-aiming-for-easier-user-access-across-servi,20231114T171214,['Anusuya Lahiri'],"Microsoft Corp MSFT and Alphabet Inc GOOG GOOGL Google have decided not to contest a European Union regulation that mandates them to simplify the process for users to switch between rival services, including social media platforms and internet browsers.",https://cdn.benzinga.com/files/images/story/2023/11/14/accuse-image_by_tumisu_from_pixaby_.jpg?width=1200&height=800&fit=crop,Benzinga,News,www.benzinga.com,"[{'topic': 'Technology', 'relevance_score': '0.5'}, {'topic': 'Retail & Wholesale', 'relevance_score': '0.5'}]",-0.002369,Neutral,[]
AMZN,What's Going On With Amazon.Com Stock Tuesday? - Amazon.com  ( NASDAQ:AMZN ) ,https://www.benzinga.com/news/23/11/35777973/whats-going-on-with-amazon-com-stock-tuesday,20231114T170956,['Anusuya Lahiri'],"Amazon.Com, Inc AMZN stock is up Tuesday, as its 'Buy with Prime' kicks off the holiday season by offering new shopping benefits This program allows Prime members to shop directly from various brands' online stores, offering fast, free delivery, a seamless checkout experience, and free returns on ...",https://cdn.benzinga.com/files/images/story/2023/11/14/amazon_prime_now_delivery_bags.jpg?width=1200&height=800&fit=crop,Benzinga,Trading,www.benzinga.com,"[{'topic': 'Retail & Wholesale', 'relevance_score': '1.0'}, {'topic': 'Financial Markets', 'relevance_score': '0.538269'}]",0.440766,Bullish,[]
AMZN,Dow Gains 500 Points On Cooling Inflation; Tesla Rises On China Price Hikes,https://www.investors.com/market-trend/stock-market-today/dow-jones-gains-500-points-on-cooling-inflation-tesla-rises-on-china-price-hikes/,20231114T162100,"['VIDYA RAMAKRISHNAN', ""Investor's Business Daily""]",Dow Gains 500 Points On Cooling Inflation. Tesla Rises On China ... Investor's Business Daily ...,https://www.investors.com/wp-content/uploads/2021/01/Stock-Tesla-modelY-01-adobe.jpg,Investors Business Daily,n/a,www.investors.com,"[{'topic': 'Life Sciences', 'relevance_score': '0.2'}, {'topic': 'Technology', 'relevance_score': '0.2'}, {'topic': 'Economy - Monetary', 'relevance_score': '0.682689'}, {'topic': 'Retail & Wholesale', 'relevance_score': '0.2'}, {'topic': 'Financial Markets', 'relevance_score': '0.999819'}, {'topic': 'Manufacturing', 'relevance_score': '0.2'}, {'topic': 'Earnings', 'relevance_score': '0.795202'}, {'topic': 'Real Estate & Construction', 'relevance_score': '0.2'}]",0.069537,Neutral,[]
AMZN,GOOGL: Top 3 Internet Stocks Investors Are Buying in November,https://stocknews.com/news/googl-amzn-meta-top-3-internet-stocks-investors-are-buying-in-november/,20231114T160916,['StockNews.com Staff'],"The internet sector is expected to grow steadily due to increasing digitization and government initiatives to make the internet available to all. Also, increased demand for online services and e-commerce platforms is adding to the internet industry's growth.",https://stocknews.com/wp-content/uploads/2022/10/Rashmi-Kumari_headshot_2-1.jpg,Stocknews.com,n/a,stocknews.com,"[{'topic': 'Retail & Wholesale', 'relevance_score': '0.333333'}, {'topic': 'Financial Markets', 'relevance_score': '0.996023'}, {'topic': 'Earnings', 'relevance_score': '0.999996'}, {'topic': 'Technology', 'relevance_score': '0.333333'}, {'topic': 'Finance', 'relevance_score': '0.333333'}]",0.265202,Somewhat-Bullish,[]
AMZN,Snap Stock Jumps On Reports Snapchat Has Amazon Deal Of Its Own,https://www.investors.com/news/technology/snap-stock-jumps-on-reports-snapchat-has-amazon-deal-of-its-own/,20231114T152300,"[""Investor's Business Daily"", 'RYAN DEFFENBAUGH']",Snap stock is rising Tuesday on reports the company has a deal to allow users to directly purchase Amazon ( AMZN ) products on Snapchat. The deal for Snap ( SNAP ) follows a similar agreement between Amazon and Facebook parent Meta ( META ) .,https://www.investors.com/wp-content/uploads/2022/02/Stock-snapchat-04-adobe.jpg,Investors Business Daily,n/a,www.investors.com,"[{'topic': 'Retail & Wholesale', 'relevance_score': '0.5'}, {'topic': 'Financial Markets', 'relevance_score': '0.955357'}, {'topic': 'Earnings', 'relevance_score': '0.972476'}, {'topic': 'Technology', 'relevance_score': '0.5'}]",0.193197,Somewhat-Bullish,[]
AMZN,What's Going On With Snap Stock Tuesday? - Snap  ( NYSE:SNAP ) ,https://www.benzinga.com/news/23/11/35771029/whats-going-on-with-snap-stock-tuesday,20231114T150006,['Anusuya Lahiri'],Snap Inc SNAP stock is on the rise Tuesday amid reports of Amazon.com Inc AMZN looking to allow Snapchat users in the U.S. to buy some products listed on the e-commerce company directly from the social media app. Amazon recently forged a similar deal with Facebook-parent Meta Platforms Inc META.,https://cdn.benzinga.com/files/images/story/2023/11/14/snapchat-photo_by_souvik_banerjee_from_pixabay.jpg?width=1200&height=800&fit=crop,Benzinga,Trading,www.benzinga.com,"[{'topic': 'Retail & Wholesale', 'relevance_score': '0.5'}, {'topic': 'Technology', 'relevance_score': '0.5'}, {'topic': 'Financial Markets', 'relevance_score': '0.108179'}]",0.196322,Somewhat-Bullish,[]
AMZN,Stocks Rally On Cool Inflation Report,https://www.investors.com/market-trend/stock-market-today/dow-jones-futures-cpi-inflation-report-tesla-stock-rallies-on-price-hikes/,20231114T144600,"['SCOTT LEHTONEN', ""Investor's Business Daily""]",Dow Jones Surges 400 Points On Cool Inflation Report. Tesla Stock ... Investor's Business Daily ...,https://www.investors.com/wp-content/uploads/2017/03/stock-wallstreet-031317-shutter.jpg,Investors Business Daily,n/a,www.investors.com,"[{'topic': 'Technology', 'relevance_score': '0.25'}, {'topic': 'Finance', 'relevance_score': '0.25'}, {'topic': 'Economy - Monetary', 'relevance_score': '0.838487'}, {'topic': 'Retail & Wholesale', 'relevance_score': '0.25'}, {'topic': 'Financial Markets', 'relevance_score': '1.0'}, {'topic': 'Manufacturing', 'relevance_score': '0.25'}, {'topic': 'Earnings', 'relevance_score': '0.158519'}]",0.213471,Somewhat-Bullish,[]
AMZN,Amazon  ( AMZN )  Boosts Reach to Snap Users With Latest Deal,https://www.zacks.com/stock/news/2183970/amazon-amzn-boosts-reach-to-snap-users-with-latest-deal,20231114T144100,['Zacks Equity Research'],Amazon (AMZN) collaborates with Snap to enable Snapchat users to make product purchases directly through promotions.,https://staticx-tuner.zacks.com/images/articles/main/14/776.jpg,Zacks Commentary,n/a,www.zacks.com,"[{'topic': 'Technology', 'relevance_score': '0.5'}, {'topic': 'Retail & Wholesale', 'relevance_score': '0.5'}]",0.30086,Somewhat-Bullish,[]
AMZN,Oracle  ( ORCL )  Alloy & Team IM to Construct Hyperscale Cloud,https://www.zacks.com/stock/news/2183907/oracle-orcl-alloy-team-im-to-construct-hyperscale-cloud,20231114T140900,['Zacks Equity Research'],Oracle (ORCL) Alloy announces that it has been selected by TEAM IM to construct New Zealand's first locally owned and operated hyperscale cloud.,https://staticx-tuner.zacks.com/images/articles/main/43/1261.jpg,Zacks Commentary,n/a,www.zacks.com,"[{'topic': 'Earnings', 'relevance_score': '0.158519'}, {'topic': 'Technology', 'relevance_score': '0.5'}, {'topic': 'Retail & Wholesale', 'relevance_score': '0.5'}]",0.152925,Somewhat-Bullish,[]
AMZN,Why These 8%+ Yielding Closed-End Funds Crush Low-Fee Index Funds,https://www.forbes.com/sites/michaelfoster/2023/11/14/why-these-8-yielding-closed-end-funds-crush-low-fee-index-funds/,20231114T131500,['Michael Foster'],"If you always wanted a free lunch but thought they don't exist, well, they kind of do, in the form of the Fidelity group of ZERO index funds, like the Fidelity ZERO Total Market Index Fund ( FZROX ) . After all, its 0% fees mean it should easily beat a closed-end fund ( CEF ) with a high expense ...",https://imageio.forbes.com/specials-images/imageserve/65524d1af89e5ab719a48d38/0x0.jpg?format=jpg&height=900&width=1600&fit=bounds,Forbes,n/a,www.forbes.com,"[{'topic': 'Life Sciences', 'relevance_score': '0.25'}, {'topic': 'Retail & Wholesale', 'relevance_score': '0.25'}, {'topic': 'Financial Markets', 'relevance_score': '0.503496'}, {'topic': 'Technology', 'relevance_score': '0.25'}, {'topic': 'Finance', 'relevance_score': '0.25'}]",0.216148,Somewhat-Bullish,[]
AMZN,Lauren Sanchez is '100 percent' excited about 'being Mrs. Bezos' - and says it comes with 'a lot of opportunities',https://www.marketwatch.com/story/lauren-sanchez-is-100-percent-excited-about-being-mrs-bezos-and-says-it-comes-with-a-lot-of-opportunities-08005843,20231114T125500,['Nicole Lyn Pesce'],"Jeff Bezos's fiancee 'blacked out a bit' when the Amazon founder proposed, she tells Vogue. And Sanchez plans to take a Blue Origin space voyage next year.",https://images.mktw.net/im-886610/social,MarketWatch,Top Stories,www.marketwatch.com,"[{'topic': 'Retail & Wholesale', 'relevance_score': '1.0'}]",0.13919,Neutral,[]
AMZN,Amazon in Charts: 3 Things Savvy Investors Should Know After Q3,https://www.fool.com/investing/2023/11/14/amazon-things-smart-investors-should-know-q3/,20231114T100500,['Bradley Guichard'],Amazon's stock price rocketed 18% after it released Q3 results. Here's why.,https://media.ycharts.com/charts/4f2426021d3cd71fa8e8411697a4c75f.png,Motley Fool,n/a,www.fool.com,"[{'topic': 'Earnings', 'relevance_score': '0.744043'}, {'topic': 'Retail & Wholesale', 'relevance_score': '1.0'}, {'topic': 'Financial Markets', 'relevance_score': '0.316726'}]",0.223024,Somewhat-Bullish,[]
AMZN,Here's what could be different about Black Friday this year,https://www.marketwatch.com/story/heres-what-could-be-different-about-black-friday-this-year-3f5a2b5d,20231114T100000,['Lauren Schwahn'],"Here's what marketing, retail and supply chain experts expect for Black Friday 2023 regarding spending, sales, deliveries and making returns.",https://images.mktw.net/im-885374/social,MarketWatch,Top Stories,www.marketwatch.com,"[{'topic': 'Economy - Monetary', 'relevance_score': '0.576289'}, {'topic': 'Retail & Wholesale', 'relevance_score': '0.333333'}, {'topic': 'Financial Markets', 'relevance_score': '0.108179'}, {'topic': 'Energy & Transportation', 'relevance_score': '0.333333'}, {'topic': 'Technology', 'relevance_score': '0.333333'}]",0.181204,Somewhat-Bullish,[]
AMZN,2 Stocks to Buy Hand Over Fist as the S&P 500 Rockets Higher,https://www.fool.com/investing/2023/11/14/2-stocks-to-buy-hand-over-fist-as-market-rallies/,20231114T100000,['Adria Cimino'],These stocks look reasonably priced today considering their long-term prospects.,https://g.foolcdn.com/image/?url=https%3A%2F%2Fg.foolcdn.com%2Feditorial%2Fimages%2F754884%2Finvestor-excited-computer.jpg&op=resize&w=700,Motley Fool,n/a,www.fool.com,"[{'topic': 'Life Sciences', 'relevance_score': '0.5'}, {'topic': 'Retail & Wholesale', 'relevance_score': '0.5'}, {'topic': 'Financial Markets', 'relevance_score': '0.161647'}, {'topic': 'Earnings', 'relevance_score': '0.714479'}]",0.366532,Bullish,[]
AMZN,"Amazon To Focus On Delivering Free Games, Plans To Slash 'Just Over' 180 Jobs - Amazon.com  ( NASDAQ:AMZN ) ",https://www.benzinga.com/general/gaming/23/11/35768461/amazon-to-focus-on-delivering-free-games-plans-to-slash-just-over-180-jobs,20231114T042440,['Ananya Gairola'],"Amazon Inc. AMZN has revealed its intention to shift focus towards delivering free games through Prime Gaming, which made way for changes like eliminating ""just over"" 180 jobs and shutting down the Crown Channel and Game Growth initiatives.",https://cdn.benzinga.com/files/images/story/2023/Amazon-Shutterstock.jpeg?width=1200&height=800&fit=crop,Benzinga,News,www.benzinga.com,"[{'topic': 'Retail & Wholesale', 'relevance_score': '1.0'}, {'topic': 'Financial Markets', 'relevance_score': '0.108179'}]",0.185925,Somewhat-Bullish,[]
AMZN,Futures: 8 Stocks To Buy And Watch With Inflation Report On Deck,https://www.investors.com/market-trend/stock-market-today/dow-jones-futures-stocks-to-buy-and-watch-with-cpi-inflation-report-on-deck/,20231113T214900,"['SCOTT LEHTONEN', ""Investor's Business Daily""]","Dow Jones futures, along with S&P 500 futures and Nasdaq 100 futures, were little changed ahead of Tuesday's open in overnight trade, as the October CPI inflation report looms. Meanwhile, eight best stocks to buy and watch in the stock market rally include tech titan Nvidia ( NVDA ) and Dow Jones ...",https://www.investors.com/wp-content/uploads/2021/03/FAB-inflation-040521-adobe.jpg,Investors Business Daily,n/a,www.investors.com,"[{'topic': 'Technology', 'relevance_score': '0.25'}, {'topic': 'Finance', 'relevance_score': '0.25'}, {'topic': 'Economy - Monetary', 'relevance_score': '0.451494'}, {'topic': 'Retail & Wholesale', 'relevance_score': '0.25'}, {'topic': 'Financial Markets', 'relevance_score': '1.0'}, {'topic': 'Manufacturing', 'relevance_score': '0.25'}, {'topic': 'Earnings', 'relevance_score': '0.158519'}]",0.206976,Somewhat-Bullish,[]
AMZN,Meta Stock Is On A Winning Streak. Analysts Like New Amazon Tie-Up.,https://www.investors.com/news/technology/meta-stock-is-on-a-winning-streak-analysts-like-the-new-amazon-tie-up/,20231113T193400,"['RYAN DEFFENBAUGH', ""Investor's Business Daily""]",Meta Stock Is On A Winning Streak. Analysts Like New Amazon Tie ... Investor's Business Daily ...,https://www.investors.com/wp-content/uploads/2022/01/Stock-meta-facebook-01-adobe.jpg,Investors Business Daily,n/a,www.investors.com,"[{'topic': 'Retail & Wholesale', 'relevance_score': '0.25'}, {'topic': 'Financial Markets', 'relevance_score': '0.999701'}, {'topic': 'Manufacturing', 'relevance_score': '0.25'}, {'topic': 'Earnings', 'relevance_score': '0.928769'}, {'topic': 'Technology', 'relevance_score': '0.25'}, {'topic': 'Finance', 'relevance_score': '0.25'}]",0.265968,Somewhat-Bullish,[]
AMZN,1 Magnificent Artificial Intelligence  ( AI )  Stock-Split Stock to Buy for Less Than $200,https://www.fool.com/investing/2023/11/13/1-artificial-intelligence-ai-stock-split-stock-to/,20231113T173000,['Adam Spatacco'],"Amazon's third-quarter report was spectacular, but the stock appears to be trading at historically cheap levels.",https://g.foolcdn.com/image/?url=https%3A%2F%2Fg.foolcdn.com%2Feditorial%2Fimages%2F753058%2Famzn-fcf.jpg&op=resize&w=700,Motley Fool,n/a,www.fool.com,"[{'topic': 'Economy - Monetary', 'relevance_score': '0.310843'}, {'topic': 'Retail & Wholesale', 'relevance_score': '0.5'}, {'topic': 'Financial Markets', 'relevance_score': '0.658903'}, {'topic': 'Earnings', 'relevance_score': '0.961735'}, {'topic': 'Technology', 'relevance_score': '0.5'}]",0.140563,Neutral,[]
AMZN,Oracle Stock: Analyst Upgrades ORCL To Buy On Cloud Potential,https://www.investors.com/news/technology/oracle-stock-analyst-upgrades-orcl-to-buy-on-cloud-potential/,20231113T171000,"['RYAN DEFFENBAUGH', ""Investor's Business Daily""]","A ""more aggressive pivot"" to cloud-based services will help drive sales growth for Oracle ( ORCL ) , according to an analyst report upgrading Oracle stock to a buy. Edward Jones analyst Logan Purk bumped ORCL stock up from neutral to buy in a report for clients late Friday.",https://www.investors.com/wp-content/uploads/2017/12/stock-Oracle-03-shutter.jpg,Investors Business Daily,n/a,www.investors.com,"[{'topic': 'Retail & Wholesale', 'relevance_score': '0.333333'}, {'topic': 'Financial Markets', 'relevance_score': '0.999998'}, {'topic': 'Earnings', 'relevance_score': '0.839681'}, {'topic': 'Technology', 'relevance_score': '0.333333'}, {'topic': 'Finance', 'relevance_score': '0.333333'}]",0.233725,Somewhat-Bullish,[]
AMZN,SentinelOne  ( S )  and Synk Team Up for Efficient Cloud Security,https://www.zacks.com/stock/news/2183415/sentinelone-s-and-synk-team-up-for-efficient-cloud-security,20231113T154400,['Zacks Investment Research'],SentinelOne (S) and Snyk enhance cyber resilience through integrated threat detection and code security for robust development.,https://staticx-tuner.zacks.com/images/articles/main/58/2932.jpg,Zacks Commentary,n/a,www.zacks.com,"[{'topic': 'Technology', 'relevance_score': '0.333333'}, {'topic': 'Retail & Wholesale', 'relevance_score': '0.333333'}, {'topic': 'Finance', 'relevance_score': '0.333333'}]",0.098291,Neutral,[]
AMZN,2 Top Tech Stocks to Buy During a Recession,https://www.fool.com/investing/2023/11/13/2-top-tech-stocks-to-buy-during-a-recession/,20231113T150000,['Dani Cook'],These companies' stocks could plunge in a recession but will likely flourish over the long term.,https://g.foolcdn.com/misc-assets/hp-sa-cumulative-growth-chart.png,Motley Fool,n/a,www.fool.com,"[{'topic': 'Economy - Monetary', 'relevance_score': '0.158519'}, {'topic': 'Retail & Wholesale', 'relevance_score': '0.5'}, {'topic': 'Financial Markets', 'relevance_score': '0.962106'}, {'topic': 'Manufacturing', 'relevance_score': '0.5'}, {'topic': 'Earnings', 'relevance_score': '0.108179'}]",0.120314,Neutral,[]
META,"WhatsApp Channels cross major milestone, Mark Zuckerberg announces new features for users",https://www.financialexpress.com/life/technology-whatsapp-channels-cross-major-milestone-mark-zuckerberg-announces-new-features-for-users-3308250/,20231116T050337,['Priya Pathak'],"Facebook chief Mark Zuckerberg announced that WhatsApp Channels has surpassed 500 million monthly active users. Channels is a new way to get updates from people, organisations, and teams you follow on WhatsApp. Channels are separate from your private chats, and who you choose to follow is not ...",https://www.financialexpress.com/wp-content/uploads/2023/11/WhatsApp-Channels-Launch.png,The Financial Express,n/a,www.financialexpress.com,"[{'topic': 'Technology', 'relevance_score': '1.0'}]",0.323071,Somewhat-Bullish,[]
META,"Sneak Peek Into Instagram's New Features For Content Creators: Updated Filters, Increase In Reels Plays, Undo-Redo Options And More",https://www.benzinga.com/news/23/11/35820095/sneak-peek-into-instagrams-new-features-for-content-creators-updated-filters-increase-in-reels-plays,20231116T045822,['pooja@benzinga.com'],"Meta Platforms Inc.'s Instagram announced that it is testing a bunch of new tools for creators on its platform this week to enhance how users create and share their content. This includes new photo filters, editing, and deeper insights into performance metrics. One of them is the filters for feed ...",https://cdn.benzinga.com/files/images/story/2023/Reels-Instagram.jpeg?width=1200&height=800&fit=crop,Benzinga,General,www.benzinga.com,"[{'topic': 'Technology', 'relevance_score': '1.0'}]",0.228622,Somewhat-Bullish,[]
META,"[Latest] Global POP Display Market Size/Share Worth USD 17.9 Billion by 2032 at a 5.3% CAGR: Custom Market Insights  ( Analysis, Outlook, Leaders, Report, Trends, Forecast, Segmentation, Growth, Growth Rate, Value ) ",https://www.benzinga.com/pressreleases/23/11/g35820006/latest-global-pop-display-market-sizeshare-worth-usd-17-9-billion-by-2032-at-a-5-3-cagr-custom-mar,20231116T043000,['Globe Newswire'],"Austin, TX, USA, Nov. 16, 2023 ( GLOBE NEWSWIRE ) -- Custom Market Insights has published a new research report titled ""POP Display Market Size, Trends and Insights By Product Type ( Counter Display, Floor Display, Pallet Display, Gravity Feed, Clip Strip, Dump Bin Display, Side Kick Display, ...",https://www.benzinga.com/next-assets/images/schema-image-default.png,Benzinga,General,www.benzinga.com,"[{'topic': 'Financial Markets', 'relevance_score': '0.684621'}, {'topic': 'Manufacturing', 'relevance_score': '0.5'}, {'topic': 'Earnings', 'relevance_score': '0.108179'}, {'topic': 'Technology', 'relevance_score': '0.5'}]",0.298714,Somewhat-Bullish,[]
META,"LAW DEADLINE NOTICE: ROSEN, SKILLED INVESTOR COUNSEL, Encourages CS Disco, Inc. Investors with Losses to Secure Counsel Before Important November 20 Deadline in Securities Class Action - LAW - CS Disco  ( NYSE:LAW ) ",https://www.benzinga.com/pressreleases/23/11/g35819706/law-deadline-notice-rosen-skilled-investor-counsel-encourages-cs-disco-inc-investors-with-losses-t,20231116T025200,['Globe Newswire'],"NEW YORK, Nov. 15, 2023 ( GLOBE NEWSWIRE ) -- WHY: Rosen Law Firm, a global investor rights law firm, reminds purchasers of common stock of CS Disco, Inc. LAW between July 21, 2021 and August 11, 2022, both dates inclusive ( the ""Class Period"" ) , of the important November 20, 2023 lead ...",https://www.benzinga.com/next-assets/images/schema-image-default.png,Benzinga,News,www.benzinga.com,"[{'topic': 'Earnings', 'relevance_score': '0.360215'}, {'topic': 'Technology', 'relevance_score': '1.0'}, {'topic': 'Financial Markets', 'relevance_score': '0.891286'}]",0.179371,Somewhat-Bullish,[]
META,Domino's dxb marks the Future of Delivery - PR Newswire,https://www.prnewswire.com/apac/news-releases/dominos-dxb-marks-the-future-of-delivery-301989980.html,20231116T023557,[],Domino's dxb marks the Future of Delivery PR ...,,PR Newswire,n/a,www.prnewswire.com,"[{'topic': 'Technology', 'relevance_score': '0.5'}, {'topic': 'Retail & Wholesale', 'relevance_score': '0.5'}, {'topic': 'Financial Markets', 'relevance_score': '0.158519'}]",0.385516,Bullish,[]
META,Palo Alto Networks CEO says demand remains high despite quarterly weakness in billings,https://www.cnbc.com/2023/11/15/palo-alto-networks-ceo-says-demand-high-despite-weakness-in-billings.html,20231116T012832,['Julie Coleman'],Palo Alto Networks CEO Nikesh Arora discussed his company's first-quarter earnings report in an interview with CNBC's Jim Cramer.,https://image.cnbcfm.com/api/v1/image/107334646-1700101275MM-C-111523-short.jpg?v=1700101274&w=750&h=422&vtcrop=y,CNBC,Top News,www.cnbc.com,"[{'topic': 'Earnings', 'relevance_score': '0.77141'}, {'topic': 'Technology', 'relevance_score': '1.0'}, {'topic': 'Financial Markets', 'relevance_score': '0.744043'}]",0.080217,Neutral,[]
